{"$schema":"https://json-schema.org/draft/2020-12/schema","$id":"gocode.release.publication-effect-intent/1","title":"Publication Effect Intent V1","type":"object","additionalProperties":false,"required":["schema_version","authority_instance_sha256","promotion","candidate_sha256","rc3_authorization_sha256","publication_manifest_sha256","final_review_sha256","allowlist_sha256","allowlist_generation","destination","channel","effect_kind","effect_scope_sha256","executor","executable_sha256","workflow_sha256","idempotency_namespace","valid_from","expires_at","revocation_epoch","generation"],"properties":{"schema_version":{"const":"gocode.release.publication-effect-intent/1"},"authority_instance_sha256":{"$ref":"#/$defs/digest"},"promotion":{"$ref":"#/$defs/id"},"candidate_sha256":{"$ref":"#/$defs/digest"},"rc3_authorization_sha256":{"$ref":"#/$defs/digest"},"publication_manifest_sha256":{"$ref":"#/$defs/digest"},"final_review_sha256":{"$ref":"#/$defs/digest"},"allowlist_sha256":{"$ref":"#/$defs/digest"},"allowlist_generation":{"type":"integer","minimum":1,"maximum":18446744073709551615},"destination":{"$ref":"#/$defs/id"},"channel":{"$ref":"#/$defs/id"},"effect_kind":{"$ref":"#/$defs/id"},"effect_scope_sha256":{"$ref":"#/$defs/digest"},"executor":{"$ref":"#/$defs/identity"},"executable_sha256":{"$ref":"#/$defs/digest"},"workflow_sha256":{"$ref":"#/$defs/digest"},"idempotency_namespace":{"$ref":"#/$defs/id"},"valid_from":{"type":"integer","minimum":0,"maximum":18446744073709551615},"expires_at":{"type":"integer","minimum":1,"maximum":18446744073709551615},"revocation_epoch":{"type":"integer","minimum":1,"maximum":18446744073709551615},"generation":{"type":"integer","minimum":1,"maximum":18446744073709551615}},"$defs":{"digest":{"type":"string","pattern":"^[0-9a-f]{64}$"},"id":{"type":"string","minLength":1,"pattern":"^[^\\s]+$"},"identity":{"type":"object","additionalProperties":false,"required":["principal_id","account_id","lane_id","key_id","signature_profile_id"],"properties":{"principal_id":{"$ref":"#/$defs/id"},"account_id":{"$ref":"#/$defs/id"},"lane_id":{"$ref":"#/$defs/id"},"key_id":{"$ref":"#/$defs/id"},"signature_profile_id":{"$ref":"#/$defs/id"}}}}}
