{"allowlist_generation":1,"allowlist_sha256":"0606060606060606060606060606060606060606060606060606060606060606","authority_instance_sha256":"0101010101010101010101010101010101010101010101010101010101010101","candidate_sha256":"0202020202020202020202020202020202020202020202020202020202020202","channel":"release-notes","destination":"github","effect_kind":"publish","effect_scope_sha256":"0707070707070707070707070707070707070707070707070707070707070707","executable_sha256":"0808080808080808080808080808080808080808080808080808080808080808","executor":{"account_id":"account","key_id":"key","lane_id":"lane","principal_id":"principal","signature_profile_id":"profile"},"expires_at":20,"final_review_sha256":"0505050505050505050505050505050505050505050505050505050505050505","generation":1,"idempotency_namespace":"ns-1","promotion":"promotion-a","publication_manifest_sha256":"0404040404040404040404040404040404040404040404040404040404040404","rc3_authorization_sha256":"0303030303030303030303030303030303030303030303030303030303030303","revocation_epoch":1,"schema_version":"gocode.release.publication-effect-intent/1","valid_from":10,"workflow_sha256":"0909090909090909090909090909090909090909090909090909090909090909"}
